sentenca,categoria
"Atendimento bom, amplo estacionamento (porém em dias movimentados fica cheio), ambiente bem agradável e os hambúrgueres deliciosos!","comida,serviço,ambiente,localização"
Ótimo café!,bebida
"A otima impressão ja começou quando cheguei apos as 23hrs (o local fica aberto até as 23h, mas devido uma forte chuva, a cidade parou nesse dia, transito ruim, alagamentos, etc) e eles entenderam isso,  tanto que a recepção antes de dizer um não, devido a hora, tratou de checar com a cozinha se poderiam ainda servir.","geral,serviço"
"A isca vem numa tapioca típica da região norte, mas o garçom não explica que essa tapioca é super dura, horrível de comer, parece que vai quebrar o dente.",comida
Experiência horrível!,geral
"Bom atendimento, cerveja gelada..","bebida,serviço"
Péssima experiência.,geral
A comida muito bem temperada e saborosa na temperatura correta.,comida
"Um bom lugar para reunir toda a família e amigos para tomar um delicioso café regional, com várias opções de tapiocas, pães.","bebida,comida,geral"
"O ambiente é excelente, mas o atendimento é muito demorado, principalmente para trazer uma simples bebida.","serviço,ambiente"
Experiência sensacional.,geral
Os melhores vinhos e a melhor gastronomia de Manaus,"bebida,comida"
Melhor café regional da cidade,bebida
Boa carta de vinho.,bebida
Café regional.,bebida
Gostei do rodízio de massas e das pizzas.. sabores diversos.. fui bem atendido pelos funcionários.. o local estava cheio neste dia.. porém agradável e alegre para quem gosta de uma baguncinha recomendo!!!,"comida,serviço,ambiente"
Não tinha variedades de carnes brancas.,comida
Excelente café regional em Manaus.,bebida
Uma churrascaria de qualidade e sempre com as melhores carnes e variedades de buffet.,"comida,geral"
atendimento maravilhoso e sabores incríveis ?,"comida,serviço"
"Muito bom mesmo, e o com ótimas variedades de pizza!","comida,geral"
Estacionamento e uma excelente variedades de carne,"comida,localização"
"Excelente atendimento, muitas opções, ótimo tempero,","comida,serviço"
"Bom astral, bons petiscos, boa música, mas precisa melhorar a qualidade do som","comida,ambiente"
Lugar lindo e café saboroso,"bebida,geral"
"Uma excelente escolha para uma noite em companhia de muita gente bonita, ótimo atendimento e uma variações de musicas.","geral,serviço,ambiente"
"Sushi delicioso, Atendimento muito demorado","comida,serviço"
"Local confortável, bom atendimento e tem o melhor café da região!","bebida,serviço,ambiente"
"Excelente restaurante, carnes saborosas e pratos acima da média.","comida,geral"
"O happy hour é uma ótima pedida, com excelentes drinks.","bebida,geral"
"O atendimento é muito bom, mas os pratos são um pouco inflacionados e não são bem servidos...vale a experiência, mas realmente não é a verdadeira experiência manauara...gourmet demais.","comida,serviço,preço"
"E cada um que for, terá a sua própria experiência se vale retorno ou não ao restaurante, eu gostei muito, se puder voltarei.",geral
"Tem uma boa variedade de pizzas no rodízio, incluindo uns 10 sabores doces, como chocolate com MMs, ovomaltine, chocolate branco, sabores que não aparecem em grande parte dos rodízios de pizza de Manaus.",comida
Fui no restaurante na semana passada e todos os pratos de peixe estavam muito bons.,comida
"Só tendo a experiência de saborear as melhores carnes, em especial costela barbecue.",comida
"Acomodações externas muito ruim, pessoas fumando em cima da gente, no mais ótimo localização.","ambiente,localização"
"Não tinha os pratos pedidos, música muito alta, barulhos perturbadores vindos do teto... Experiência não muito boa.","geral,comida,ambiente"
"Tem cachaça de tudo quanto é qualidade, cervejas exóticas, tipo de açaí, umas comidas bem legais e muitas coisas importadas.","bebida,comida"
"Excelente lugar para tomar um bom café, comer deliciosa torta, lugar aconchegante e propício para se reunir com a família.","bebida,comida,ambiente"
Ótimo lugar para tomar um ótimo café e reunir os amigos,"bebida,geral"
"Excelente lugar para reunir com amigos no final da tarde, bons petiscos e preço.","comida,geral,preço"
Baião com tempero único.,comida
"Bar localizado no Largo São Sebastião, serve um ótimo sanduíche de pernil com cerveja bem gelada, ponto de encontro de jornalistas e da boemia da cidade","bebida,comida"
"Maravilhoso esse lugar comida boa bebida, bem familiar, amplo e bem organizado.","bebida,comida,geral"
Tive uma experiência nem um pouco agradável com o Restaurante.,geral
Couvert artistico valeu a pena.,ambiente
"Local amplo, cafe bom.","bebida,ambiente"
Entrada com um couvert excelente e o melhor camarão e ainda mais com um atendimento  De alto nível  feito pelo Rodrigo Uchoa.,"comida,serviço,ambiente"
"Bela carta de vinhos, bebidas diversas, peixes muito saborosos e sobremesas divinas.","bebida,comida"
"Comida maravilhosa, super descontos e bebida incrível.","bebida,comida,preço"
"Ótimo ambiente, excelente atendimento, comida boa e cerveja gelada.","bebida,comida,serviço,ambiente"
"Boas carnes e ambiente agradável, peca por falta de opções de cardápio.","comida,ambiente"
"Uma delícia, sabe aquele lugar da sua infância, que te faz imaginar e brincar com os pensamentos, tem uns peixes empalhados muito daora hahaha, pra quem é de fora igual eu foi muito legal conhecer, atendimento nota 10, petiscos regionais  deliciosos hummm... prato principal bem servido, pois quase não conseguíamos dar conta de tudo, tudo bem fresco, feito na hora, bom para crianças, adultos e idosos, pra todos!","geral,comida,ambiente,serviço"
"Tudo organizado, café regional maravilhoso","bebida,geral"
Lugar agradável para apreciar um bom café,"bebida,geral"
"Cerveja geladissima, bom atendimento, ótimos preços e cardápio variado, ambiente climatizado.","bebida,comida,serviço,ambiente,preço"
"Muito boa pizza, ótimas variedades de pizza.",comida
"Ótimo ambiente ,com um bar para você esperar sua companhia, com uma boa carta de bebidas,a comida é excelente e o atendimento é bom ,porém os preços são um pouco elevados,mas vale a pena uma visita ao local.","bebida,comida,serviço,ambiente,preço"
"Cerveja gelada, bom atendimento e música agradável.","bebida,serviço,ambiente"
Hambúrguer delicioso e preços variados para todos os bolsos.,"comida,preço"
"Cozinha deliciosa e com pratos bem preparados, tempero suave em sintonia com as recomendações atuais dos nutricionistas.",comida
Tem várias opções de pratos e sucos regionais.,"bebida,comida"
Atendimento e bebidas excelentes.,"bebida,serviço"
Salgados quentinhos e chegaram bem rápido.,"comida,serviço"
"Restaurante de culinária portuguesa, de longa tradição em Manaus (mais de 20 anos), o Alentejo não decepciona aos amantes de uma boa bacalhoada, em todas as suas mais diversas variedades.","geral,comida"
Sucos regionais espetaculares.,bebida
"Fomos em um grupo grande, então foi possível provar vários pratos...Mais",outros
É o melhor café regional dentro da cidade.,bebida
"Péssima experiência,  buffet  pobre, carnes duras, poucas guarnições, não recomendo,além disso, preço caro, pelo custo x benefício!","geral,comida,preço"
Aqui tem a melhor picanha e as melhores carnes nobres de manaus,comida
"Tive a recomendação de ir quando estava no Restaurante Terra e Mar, que é do mesmo grupo.",outros
Experiência boa.. Ainda mais se for cedo,geral
"Sabor das carnes muito bom, podendo pedir o ponto da carne bem...Mais",comida
Cerveja gelada,bebida
Aceitam encomendas para datas festivas.,outros
"A entradinha, um caldo de tambaqui já abre alas pra uma boa experiência gastronômica.",comida
Muito bom café da manhã e opções de bolo e sanduíches.,"bebida,comida"
"Primeira vez, ótima experiência.",geral
"Atendimento muito ágil, ótimas opções de bebidas quentes e geladas e o pão de tucumã e castanha é simplesmente PER-FEI-TOO!","bebida,comida,serviço"
"Um lugar bonito, café boa e comida boa.","ambiente,bebida,comida"
Café regional maravilhoso.,bebida
A cerveja mais gelada de mais atendimento 100%,"bebida,serviço"
"Ambiente bem limpo e climatizado, também tem sucos naturais e saladas, bem como descontos com cartão fidelidade.","bebida,ambiente,preço"
Não desejo esta horrível experiência à ninguém,geral
"Uma boa carta de vinhos, de várias nacionalidades, não me lembro de estar especificado no cardápio mas eles existem.",bebida
"Grande variedade de Pizzas, de massa fina, no sistema rodizio, saborosas, o custo-benefício e´ um dos atrativos da casa.","comida,preço"
"O preço tá alto, a qualidade e quantidade das porções estão deprimentes, a carne vem com meio quilo de gordura derramando óleo e ignoram o ponto que o cliente pede... Foi triste essa última experiência!","geral,comida,preço"
Ótimo ambiente e ótimas bebidas.,"bebida,ambiente"
"Experiência lamentável, sem exagero, pedi para ser atendido umas 3 vezes e os atendentes não vinham, passei aproximadamente 15 minutos em pé aguardando para sentar, depois de conseguir sentar passamos mais uns 25 minutos e não fomos atendidos.","geral,serviço"
"Ótimo lugar para ir com a família, bom atendimento, variedades de lanches, sorvetes bebidas e drinks.","bebida,comida,serviço,geral"
"sempre que tenho tempo, tom meu café regional !",bebida
Que café delicioso,bebida
Churrasco e variedades saborosas,comida
"Experiência maravilhosa, muito atencioso, educado, cortes, prestativo… ???????","geral,serviço"
"Atendimento ótimo do Senna, ambiente aconchegante,espaçoso, som com boa escolha de estilos, a comida 100% maravilhosa e bem servida.","comida,serviço,ambiente"
"ambiente super agradável, carne de primeira, atendimento excelente, cerveja gelada","bebida,comida,serviço,ambiente"
"Experiência muito boa, pista e bolas de boliche sem defeitos, boa comida... Um bom lugar pra se divertir!","geral,comida,ambiente"
"Música ao vivo, bons drinks e com ótima apresentação.","bebida,ambiente"
"Adorei conhecer o local, tive uma boa primeira impressão.",geral
"Os pratos servidos lá conseguem combinar sabores regionais e ingredientes internacionais, o que começa com o caldinho de entrada.",comida
"Marcela foi super atenciosa <3 Petiscos deliciosos e no tempo, e as bebidas pra acompanhar ?","comida,serviço"
"Cerveja gelada, petiscos bons (especialmente o bolinho de bacalhau).","bebida,comida"
"Situado ao lado do Teatro Amazonas num sobrado antigo, esse espaço serve para um agradável  fim de noite para o público que vai ao Teatro.",ambiente
Enfim uma excelente opcao de lazer.,geral
"Ótimo atendimento, temperatura agradável","serviço,ambiente"
"Além de possuir cervejas amazonenses, possuem cervejas de todos os locais do Brasil (ex: Cerpa) Para comer, experimentei...Mais",bebida
"Atendimento maravilhoso, bem localizado é um sushi divino.","comida,serviço"
"ambiente agradável, bom bacalhau e boa carta de vinhos.","bebida,comida,ambiente"
"Ótimo lugar para um bom café regional, comer a vontade e preço justo!","bebida,comida,preço"
Experiência fantástica.,geral
Decoração de cachacaria e comida de restaurante de ponta.....chopp ou cerveja gelados e diversas opções de cachaça para abrir o apetite.,"bebida,comida,ambiente"
"Ótimo local para um happy hour, ótimo ambiente e muita gente bonita.","geral,ambiente"
"Comparativamente ao Coco Bambu de Brasília, achei os pratos melhores servidos de camarão.",comida
"Caros amigos Turistas, não percam a oportunidade de tomar o melhor café regional de Manaus, muitas variedades de especiarias regionais, o famoso pão com tucumã, a tapioca bem quentinha, com castanha/queijo, banana frita, sucos regionais, cupuaçu, tapereba, goiaba, muito bom mesmo, não deixem de visitar!!","bebida,comida,geral"
Tive uma experiência não tão boa pedindo açaí via whatsapp na qual meu açaí veio com muito excesso de cobertura ( quase metade do copo) porém foram muito rápido e solícitos em resolver o problema.,comida
"?Som de boa qualidade, cerveja gelada!","bebida,ambiente"
"Comida muito boa, serviço de primeira, bons vinhos.","bebida,comida,serviço"
"Cerveja gelada, ambiente descontraído, música  de qualidade, gente interessante é de frente pro maior cartão postal da cidade (Teatro Amazonas)...","bebida,ambiente"
"Ótimo restaurante, cardápio repleto de comidas gostosas e com sabores divinos.","comida,geral"
"Garçom Celso, ótimo atendimento, uma experiência incrível, super recomendo!","geral,serviço"
"Ótimo café, achei o preço um pouco elevado, mas o ambiente é realmente muito bacana.","bebida,ambiente,preço"
Cervejas regionais e petiscos para quem quer curtir.,"bebida,comida"
Cafe expresso delicioso!,bebida
Excelente experiência degustativa.,comida
"Tem a pedida tradicional que é o sanduíche de pernil e dependendo do dia um bom pagode, como se encontra no Rio.","comida,ambiente"
"Porém, alguns pontos precisam ser observados: A feijoada, carro-chefe do fds do bar, servida em estilo buffet por R$ 39,90, não estava numa boa temperatura, simplesmente tava do normal para o frio.",comida
"Tambaqui e pirarucu estavam no ponto certo e a farinha típica, com tempero especial!!!",comida
"Excelente lugar, ambiente climatizado, perfeito para um bom café, tudo de qualidade.","bebida,ambiente,geral"
"gostei muito,excelente atendimento,ótima degustação amei","geral,serviço,comida"
Buffet livre com uma grande variedade de pratos regionais.,comida
"Muito bom, só deveria ter uma variedades maior de sobremesas","comida,geral"
mesma embalagem vai pro microndas...otima ideia..e delicioso com preço bom...parabens frango mineiro,"comida,preço"
"O Banzeiro é um restaurante mais sofisticado, com ar condicionado, bom atendimento, boas bebidas e um variado cardápio de comidas regionais.","bebida,comida,serviço,geral,ambiente"
"Lugar agradável, atendimento maravilhoso, cerveja geladinha.","bebida,serviço,geral"
"Cerveja gelada, mesas na calçada e na via, Esquenta depois das 17 mas pode chegar antes para ouvir o chorinho.Vale demais a pena.Tem que conhecer.","bebida,ambiente,geral"
Café delicioso!!,bebida
Café regional muito bom.,bebida
"Simplesmente um dos melhores senão o melhor para comer um hambúrguer delicioso, ambiente interno climatizado e externo arejado, estacionamento amplo e descoberto (o que não faz a menor diferença), e o principal, os melhores hambúrgueres da cidade de Manaus!","comida,ambiente,localização"
Restaurante de comidas típicas maravilhosas.,comida
Cachaças e cervejas muito boas.,bebida
"Funcionários excelentes, rodízio bem servido, muito barulho ( normal para um público jovem).","comida,serviço,ambiente"
Hambúrguer delicioso e de qualidade!,comida
Excelente experiência.,geral
"O Paulo deixou a gente muito confortável, atendeu muito bem, comida deliciosa.","comida,serviço"
Uma das melhores festas de Manaus,geral
"Refrigerante quente, falta de educação dos funcionários estrangeiros .","comida,serviço"
"Música boa, gente bonita, cerveja gelada!","bebida,ambiente"
"Cara que lugar bom, o atendimento é perfeito, e o café melhor ainda.","bebida,serviço,geral"
"Má atendimento, bebidas quentes e não inclusas.","bebida,serviço"
"Café típico da região e o famoso caboquinho, lanche típico","bebida,comida"
"A churrascaria tem um ambiente sofisticado com carnes nobres e saborosas além de bufês e guarnições que são preparadas na hora, os garçons são atenciosos e preparados, o preço diferente dos pratos, um pouco salgado.","comida,serviço,ambiente,preço"
Procurar uma embalagem melhor pra manteiga de garrafa que fica com a mão pegajosa depois que se serve!,comida
"Carnes diversas, acompanhamentos saborosos, e atendimento maravilhoso.","comida,serviço"
"Melhor menu, excelente carta de vinhos!","bebida,comida"
Tradicional em Manaus... Ótima comida e grande diversidade de bebidas,"bebida,comida,geral"
"Café regional normal, simples, com todas as opções regionais, mas sem muito destaque.",bebida
Boa carta de vinho.,bebida
"Atendimento ótimo do DENYS, muito educado, gente boa, muito bom ??",serviço
"Experiência ótima, comida de primeira, atendimento vip .","comida,serviço,geral"
Com opção de carnes nobres.,comida
Bom eu fui no café da br-174 no Km 12.,outros
Cerveja gelada e boa carta de vinhos.,bebida
"De A a Z, desde o atendimento sem o mínimo de preparo para uma simples venda dos pratos da casa, a bebida (cerveja quente) e...Mais","bebida,comida,serviço"
O único problema é o barulho insuportável dos clientes conversando alto.,ambiente
Vinho delicioso!,bebida
Um ótimo lugar para curtir uma cerveja geladinha e a boa música brasileira.,"bebida,ambiente"
"Hambúrgueres excelentes, drinks muito bem servidos.","bebida,comida"
ótimo local para tomar uma cerveja gelada e passar o tempo com amigos.,"bebida,geral"
Boa cerveja e chope bem gelado.,bebida
"Boa refeição, só não gostei foi da cobrança da brinquedoteca, que por sinal, estava um forno muito quente.","comida,ambiente"
"O famoso bolinho de feijoada é sempre uma boa pedida, porém a tradicionais picanha na chapa, super tradicional da casa ficou à desejar, chegou extremamente frio, com cara...Mais",comida
"Sabores surpreendentes, como a pizza amazonia, que leva diferentes ervas.",comida
"Possui atendimento rápido, espaço grande e disponibilidade para pequenas e grandes reservas!","serviço,ambiente"
Garçons com um excelente treinamento e as carnes com ótimos cortes e comida muito gostosa.,"comida,serviço"
Tapioca e sucos regionais muito bom.,"bebida,comida"
"Experiência absurda , muito bom!!!!",geral
"Excelente café regional, tudo maravilhoso, atendimento muito bom, o x-caboquinho muito bom, bananas fritas deliciosas, tapiocas maravilhosa, só e uma pena funcionar nos fim de semana.","bebida,geral,serviço,comida"
"A idéia das cervejas especiais é bem vinda, desde que estejam no cardápio, belgas frutadas, inglesas lupuladas, alemãs tradicionais e ipa e ales americanas somente, nada mais que 2 de cada tipo citado e apresentadas da maneira correta também.","bebida,comida"
Uma ótima experiência gastronômica.,comida
"Lugar tranquilo, climatizado, ótimo para se divertir com os amigos, além de um somzinho interativo (karaokê), tem petiscos deliciosos, banheiro disponível, garçons elevadíssimos, e um ambiente mais reservado para uma conversa com o crush.","comida,serviço,ambiente,geral"
Que experiência maravilhosa com a gastronomia amazonense.,comida
"Café regional muito gostoso, para quem quer saborear uma ótima tapioca com gosto regional, é uma boa opção de local.","bebida,comida,geral"
lugar ótimo de gente bonita e ambiente maravilhoso... Só uma obs não tem onde estacionar e isso é muito chato ainda mas este sábado passado que estava chovendo quase não saíamos do carro lamentável ?,"ambiente,localização"
Experiência muito agradável.,geral
"O ambiente é espaçoso, com música ao vivo e cerveja gelada.","bebida,ambiente"
Foi realmente uma experiência maravilhosa.,geral
"Atendimento, comida e bebidas excelentes","bebida,comida,serviço"
Generosa e gostosa porção de pastéis  de queijo e música so vivo  de qualidade.,"comida,ambiente"
Ótimo experiência com a culinária local,comida
"Serve cerveja gelada, caipirinha e outras.",bebida
Café da manhã top!,comida
"As bebidas chegam bem todavia o barulho do local incomoda quem quer conversar e saborear... alguns tira gostos existentes, os quais demoram muito para ficarem prontos e chegarem as pessoas que o solicitaram...","bebida,comida,serviço,ambiente"
Tapioca muito deliciosa.,comida
"Olha.. estava dando 5 estrelas FÁCIL… até ver a conta.. estava tudo muito bom.. comida gostosa (com preço justo) e cerveja gelada.. mas qnd veio a conta vimos que estavam cobrando R$25,00 na cerveja tijuca.. estava no cardápio?","bebida,comida,preço"
"Melhor experiência, nunca tive....",geral
"Vá com calma e não se estresse, será uma boa experiência, as pizzas são boas!","geral,comida"
Melhor opção de carnes vermelhas em Manaus.,comida
Há sucos naturais e cerveja gelada.,bebida
"Um lugar ótimo para tomar uma cerveja bem gelada, ótimo atendimento, petiscos e tira gostos muito bons, além dos pratos da cozinha portuguesa.","bebida,serviço,comida"
"Festas temáticas, ótimas comidas e claro, atendimento 100%  Obrigado pela vivência.","comida,serviço,ambiente"
Ambiente agradável e pessoal atencioso.,"ambiente,serviço"
"Visitei o Café Priscila numa quarta-feira, foi uma boa experiência.",geral
"Espaço p crianças, diversão para adultos e petiscos deliciosos, e tem estacionamento.","comida,ambiente,localização"
"O atendimento foi maravilhoso, ganhei um desconto comprando 1 torta e 1 cento de salgadinho de bolinha de queijo (unica opcao que tinha).",serviço
"Mais uma vez ,surpreendido com essa maravilha de cardápio, agora com outras poções exuberante, como sempre atendentes atenciosos, 'mais' desta vez precisou da ajuda de sua gerente para indicar um bom vinho, que por sua vez super agradável na combinação indicada por ela, tudo maravilhoso...Mais","comida,serviço"
Destaque para os drinks com sabores locais.,bebida
Experiência maravilhosa.,geral
Carta de vinhos ótima também.,bebida
"Super aconchegante, café delicioso","bebida,ambiente"
"Estive em fevereiro de 2020, experimentei o serviço de lanche da tarde com buffet livre R$ 25,00 por pessoa, incluindo bebidas, sanduíches e tapioca.",outros
Excelente restaurante com variedades diversas  e bom atendimento.,"geral,comida,serviço"
"Muito boa surpresa em serviço, comida regional muito boa, lugar extremamente agradável e muito bom serviço, com o pessoal muito prestativo e atenciosos... Muito bom vale a pena ir.","comida,serviço,ambiente,geral"
"Mas se você pode pagar diariamente, bom apetite.!!",comida
"Ao tomar o Café vc viaja nas nuvens com a pureza do café moído na hora, simplesmente apaixonante.",bebida
"Fui com um grupo grande de 24 pessoas e eles se atrapalharam com o serviço, servindo cada prato em momentos diferentes, tendo pessoas ainda sem terem sido servidas quando...Mais",serviço
Bom café e ambiente agradável,"bebida,ambiente"
Ótima refeição com atendimento de qualidade e sabores incríveis.,"comida,serviço"
Vários sabores muito saborosos por um bom preço :),"comida,preço"
"Para a minha primeira impressão, Tive uma experiência agradável, fui bem atendido e me admirei com a eficiência dos pedidos não tem miséria.","geral,serviço"
"Gente finíssima, atencioso e engraçado.",serviço
"Carnes muito saborosas, porém, pouca variedade.",comida
"Fomos bem atendidos, com explicações detalhadas da composição dos produtos produzidos e o serviço de café delicioso.","bebida,comida,serviço"
O dono é gente finíssima!,serviço
"Ótimo restaurante, um dos melhores sushi de Manaus .","geral,comida"
"Atendimento, comida,ambiente... Sem dúvida e a melhor rede de restaurantes do Brasil!","geral,comida,serviço,ambiente"
Petiscos excelentes e cerveja mega geladaaa,"bebida,comida"
Uma grande variedades de cervejas importadas e ótimos pratos.,"bebida,comida"
"Comida excelente, cerveja gelada, e atividades acuáticas!","bebida,comida"
"Ambiente incrível, e o melhor da culinária Portuguesa e Argentina, incluindo uma excelente carta de vinhos.","bebida,comida,ambiente"
"Ótimo ambiente, refrigerado, estacionamento, bom atendimento, chamada do garçom através de sinal eletrônico na mesa, tvs em ambos os lados, decoração com capas dos discos do Roberto Carlos e ótimas sobremesas","comida,ambiente,serviço,localização"
"Doces, salgados e comida gostosa",comida
Experiência única.,geral
"Lugar de gente bonita, comida boa e bebida para todos os gostos.","bebida,comida,ambiente"
"Ambiente informal, cerveja gelada, cozinha portuguesa.","bebida,comida,ambiente"
"Pratos bem elaborados, peixe de rio, tempero excelente.",comida
"Carnes maravilhosas , custo benefício , atendimento de primeira , ambiente  Agradável , música ambiente sensacional","comida,serviço,ambiente,preço"
"Cerveja na temperatura ideal, o melhor do bar.",bebida
Doces deliciosos,comida
"Presencialmente, nunca passei por uma experiência ruim lá.",geral
"Venha conhecer uma bar com a cerveja super gelada, tira gostos saborosos e atendimento vip.","bebida,comida,serviço"
Pratos com ingredientes regionais simples que tornam-se exuberantes pela harmonia e preparo profissionais.,"comida,serviço"
"Tive uma pessima experiência, a pizza chegou fria, a massa parece uma panqueca grudenta, molho ruim borda ruim, nunca mais irei pedir.","comida,geral"
"Comida boa, porém a demora acabou deixando a experiência ruim.","comida,serviço"
"Possui um cardápio de pratos baseados na culinária Amazonense, possuindo grande diversidade de peixes no conteúdo.",comida
Ótimas combinações de sabores regionais.,comida
"Ótima comida Regional, ambiente super limpo, seguro, bem localizado, climatizado, cardápio em português e inglês, boa carta de vinhos, dispõe de uma brinquedoteca na parte inferior e um bom estacionamento com staff.","bebida,comida,ambiente,localização"
Experiência maravilhosa que tivemos para comemorar meu aniversário e noivado.,geral
"Muito bom essa churrascaria no também badalado Vieiralves, atendimento excelente ambiente muito agradável, vista panorâmica e uma variedade de carnes e opções de  outras cozinhas [japonesa] também, carta de vinho simples não muito longa porém com alguns bons rótulos.","bebida,comida,serviço,ambiente"
Grande variedade e comidas e bebidas típicas.,"bebida,comida"
