sentenca,categoria
"Achei o preço bom 27 reais buffet livre, a comida estava deliciosa e o ambiente é silencioso, como eu gosto.","preço,comida,ambiente"
"Pra padrão de qualidade do restaurante é um ótimo custo benefício, ainda mais no happy hour em que várias entradas e bebidas custam a metade do preço normal.",preço
"Muito legal, excelente ambiente familiar, ótimo atendimento e refeições típicas e não típicas e muito bom, preço bem acessível.","preço,comida,serviço,ambiente"
"Ambiente aconchegante, preço justos, comida saborosa e ótimo atendimento (em especial ao garçom Robson).","preço,comida,serviço,ambiente"
Atendimento nota 10 preço justo e cerveja geladissima,"preço,bebida,serviço"
Ótimo custo x benefício.,preço
"Pra padrão de qualidade do restaurante é um ótimo custo benefício, ainda mais no happy hour em que várias entradas e bebidas custam a metade do preço normal.",preço
Preço um pouco salgado.,preço
Cardápio muito legal.. Entrada de pastel de pato.. Tambaqui muito Show.. Não achei preço excessivo.,"preço,comida"
Preço justo para Manaus!!!!,preço
Vale a pena apesar do preço ser um pouco salgado.,preço
Preço justo por tudo o que oferece.,preço
Comida deliciosa e preço muito bom.,"preço,comida"
Aí o rapaz me informou que deveria falar com o dono..aí o dono autorizou mediante uma quantia de 35 reais....afff estava de palhaçada se fosse por um preço razoável pagaria sem problemas.,preço
Boa comida por um preço justo,"preço,comida"
Preço bem diferente dos restaurantes de São Paulo.,preço
Não oferece o melhor serviço nem o melhor preço mas também fornece uma comida muito boa.,"preço,comida"
"Atendimento excelente, todos muito simpáticos e atenciosos, tem preço justo e a carne é bem saborosa, assim como as porções.","preço,comida,serviço"
"Fui com minha família e adorei todinho complexo de restaurantes, bares e chopps onde se localiza o Muy Gringo.Super aprovado e indicado, preço justo, atendimento foi um pouco lento no dia que fui, mas deu tudo certo no final.","preço,bebida,serviço"
Kkkkkkkk serviço rápido e preço justo!,"preço,serviço"
E tem bom preço!!,preço
"Massas sempre saborosas, preço acessível e cardápio bem variado fazem deste lugar uma ótima opção para fast food de boa qualidade.","preço,comida"
"Os atendentes são super atenciosos e tem o melhor valor de bebidas de Manaus, já que uma coca de 1 L custa 3,00 ?","preço,serviço"
"Vale a pena fazer uma visita e conferir os pratos deliciosos, é um lugar seguro, confortável,refrigerado, familiar e romântico, preço  acessível,","preço,comida,geral,ambiente"
"Ótimo Restaurante, bom atendimento e preço acessível.","preço,serviço,geral"
"Lugar mais que aconchegante, com preço justo, comida deliciosa e impecável na preparação e apresentação.","preço,comida,ambiente"
"Tudo limpo, feito na hora e bom preço!","preço,comida,ambiente"
O preço pouco alto mas vale a pena a experiência.,"preço,geral"
Muito boa comida e preço justo,"preço,comida"
Bom atendimento e preço justo.,"preço,serviço"
Preço bem em conta e comida muito boa,"preço,comida"
"Boa comida, ambiente agradável e preço bom, mas o estacionamento é ruim.","preço,comida,ambiente,localização"
"Comida boa, preço razoável.","preço,comida"
Bar temático com ótimos comes e bebes e preço justo.,"preço,comida,bebida,ambiente"
"Excelente atendimento, preço bom e na minha opinião o mais saboroso","preço,serviço"
Ótimo preço!,preço
Excelente churrasco!Atendimento ágil e cordial.Preço justo pela qualidade dos serviços.Uma grande variedade de carnes.Super indico.,"preço,comida,serviço,geral"
"Ótimo lugar, melhor custo benefício.","preço,geral"
"estacionamento amplo, atendimento exclusivo, comida adorável e o preço acessível!","preço,comida,serviço,localização"
"comida ótima, mas custo benefício ruim... e o atendimento tambem","preço,comida,serviço"
Um salgado mais gostoso que outro e atendimento excelente ?,"comida,serviço"
Vale apenas conhecer pelo valor histórico do lugar,geral
"Atendimento bom e preço um pouco alto, mas ainda assim pode-se considerar justo pois é bem servido.","preço,serviço,comida"
Preço justo.,preço
"Lugar agradável, comida deliciosa, atendimento de primeira (recomendo procurar o Marcelo ou Gabriel), preço razoável.","preço,comida,serviço,geral"
Preço compatível com o que é oferecido.,preço
E Preço baixo para a região.,preço
Preço justo.,preço
"Lugar com gente bonita, rock bom, refrigerado, boa musica, preço razoável, excelente atendimento, só precisa ampliar o espaço, pois esta pequeno para a quantidade do publico.","preço,ambiente,serviço"
Se você está cansado de almoçar nos outros restaurantes próximo da UFAM... Merece ir almoçar.. Preço justo e ótimo atendimento..,"preço,serviço"
"Carnes maravilhosas , custo benefício , atendimento de primeira , ambiente  Agradável , música ambiente sensacional","preço,comida,serviço,ambiente"
"Rapidez no atendimento aliada a qualidade, comodidade, boas opcoes no cardapio, preço bom e picanha perfeita!","preço,comida,serviço"
"A comida é boa, preço bom e ambiente muito agradável!!","preço,comida,ambiente"
Existem estabelecimentos com comida mais incrementada em Manaus pagando-se o mesmo valor.,"preço,comida"
Ótimo para se divertir com os amigos com um preço justo,"preço,geral"
"Local descontraído e agradável, cervejas muito geladas e com preço justo, além de apresentação de bandas e cantores...Mais","preço,bebida,ambiente"
"Caipirinha forte, happy hour muito bom, melhor custo benefício.","preço,geral,bebida"
Excelente atendimento e preço justo.,"preço,serviço"
Custo benefício ótimo.,preço
"Ótima opção, fácil acesso, estacionamento amplo, variedade no cardápio, comida saborosa, bom preço, qualidade satisfatória, bom atendimento.","preço,localização,comida,serviço"
Muito saborosa e um preço justo.,"preço,comida"
"Além disso, possui um preço abusivo, fora dos padrões dos melhores restaurantes de Manaus por uma comida bem fraca.","preço,comida"
Preço justo pela comida e serviço ( em torno de 80 por pessoa).,"preço,comida,serviço"
Preço alto.,preço
"Ótimo lugar, bom atendimento, preço super bom!!!","preço,serviço,geral"
"Ótimo preço para o tipo de alimento, atendimento rápido e de qualidade","preço,comida,serviço"
"Localidade ótima, clima ótimo, preço bom, comida muito ótima, e ainda tem bastante variedade, tudo é muito bom aqui","preço,comida,localização,ambiente,geral"
"Com uma decoração pitoresca e bom atendimento, recomendo para que quer provar a gastronomia local, apresenta um bom custo benefício, com preços médio entre R$50,00 e R$100,00.","preço,ambiente,serviço,comida"
Na minha opinião não vale o custo benefício.,preço
Ótimo custo beneficio!,preço
"Comida saborosa, bom atendimento e bom custo/benefício.","preço,comida,serviço"
"Comida excelente, porém o preço absurdo!","preço,comida"
Ótimo preço e atendimento de primeira!,"preço,serviço"
"X cabloquino uma delicia,  ambiente gostoso,  preço compatível.","preço,comida,ambiente"
Ótimo atendimento e preço justo!,"preço,serviço"
"A comida deste local é muito boa, com preço um pouco salgado.","preço,comida"
"Rápido, gostoso, preço justo e tem estacionamento","preço,comida,serviço,localização"
Ótimo custo benefício!,preço
"Comida gostosa, limpeza externa boa, preço justo pendendo pro barato e atendimento regular!","preço,comida,serviço,ambiente"
Muito boa comida.Preço justo.,"preço,comida"
Custo incompatível com os serviços e refeição oferecidos.,"preço,comida,serviço"
Preço justo para Manaus.,preço
A melhor picanha de Manaus com um preço justo.,"preço,comida"
Uma vasta opção de bebidas e um preço bem acessível,"preço,bebida"
"Pratos variados e bem elaborados, bons drinques, ambiente climatizado e preço justo pela qualidade.","preço,comida,ambiente,bebida"
Bom custo benefício.,preço
"Atualmente o preço esta muito alto para o que oferece, já foi a melhor churrascaria de Manaus  mas caiu de qualidade, ambiente muito bom e agradável, espero que melhore as variedades de carnes, pratos e saladas.","preço,comida,geral,ambiente"
"Boa comida, preço justo","preço,comida"
"Bons pratos, preço justo, ambiente e decoração agradável, bom atendimento.","preço,comida,serviço,ambiente"
Porém o preço esta um pouco alto!,preço
"Molho espetacular, preço justo e bom atendimento.","preço,comida,serviço"
Preço acessível e comida maravilhosa.,"preço,comida"
"Preço justo, atendimento cordial, comidas deliciosas","preço,comida,serviço"
E tem bom preço!!,preço
"Lugar excelente , comida boa e preço bom","preço,comida,geral"
Pizzas e massas saborosas com preço acessível.,"preço,comida"
"Área kids, ambiente climatizado e o melhor peixe da Cidade por um preço justo!","preço,comida,ambiente"
Boa atendimento e preço justo.,"preço,serviço"
"O  ambiente é ótimo como o atendimento também.. mas a comida é bem comum, vc pode comer algo mais gostoso por um valor bem menor.","preço,comida,ambiente,serviço"
com um valor ótimo...,preço
Preço justo,preço
"Local bem simples, preço acessível, a música ao vivo é sembre bacana independente se vc odeia o estilo q estiver tocando, não me pergunte que mágica é essa, mas a diversão é garantida","preço,ambiente,geral"
"Rodízio maravilhoso,há um preço ótimo de 25,00 por pessoa.","preço,comida"
"Preço 'alto' porém os pratos são bem servidos, é possível dividir com mais pessoas tranquilamente, portanto o preço compensa.","preço,comida"
"A dica: o Banzeiros dá de dez no Alentejo, em sabor, em serviço e o custo benefício é infinitamente melhor.","preço,comida,serviço"
Preço justo.,preço
"Conhecendo a grande maioria se não todos em Manaus , aqui são servidas  carnes variadas no ponto que desejar e acompanhamentos adequados, com ótimo preço, maitres e garçons  atenciosos.","preço,comida,serviço"
Preço acessível e lanche delicioso .,"preço,comida"
"Os cortes bovinos são bons, mas não impressionam muito, ainda mais pelo alto preço cobrado.","preço,comida"
"Ótimo preço, acessível para todos.",preço
"Ambienta super agradável, atendimento simpático e simples, carnes de excelente paladar, custo benefício atrativos.","preço,comida,ambiente,serviço"
"Muito boa,comidas e lanches deliciosos e bom preço","preço,comida"
Comida boa custo benefício ótimo!,"preço,comida"
"Bom atendimento, preço justo, pelo q é oferecido.","preço,serviço"
"Preço justo, comida muito boa!","preço,comida"
"Atendimento de primeira, e preço bom.","preço,serviço"
"Comida balanceada e ótimo preço, sobremesa deliciosa","preço,comida"
"Melhor café da manhã regional, preço muito alto, atendimento ok. Dois ambientes, climatizado e ao ar livre, muito familiar.","preço,comida,serviço,ambiente"
bom atendimento e preço justo.,"preço,serviço"
"Possui sala de jogos para quem aguarda a liberação da pista, Cerveja Gelada, e os petiscos a um preço muito justo.","preço,ambiente,bebida"
"Excelente comida, bom preço, pratos variados e ótimo atendimento.","preço,comida,serviço"
Bom custo benefício para quem gosta de Carne de Sol!,"preço,comida"
Estive la esta semana que passou e pedimos picanha e costela por peso Estava muito bom com preço bem aceitavel Serviço bom e carne bem feita,"preço,comida,serviço"
Pratos fartos e com bom custo benefício!,"preço,comida"
Café bom com preço bom bem diversificado,"preço,bebida"
Eles têm um sistema de café e leite em garrafas que sai a um preço único independente do consumo.,outros
Refeição rápida  e preço baixo.,"preço,comida"
"Péssimo lugar, comida sem qualidade e preço horrível!","preço,comida,geral"
"O sabor foi muito bom, ainda não tinha comido pizzas tão neste tipo de massa fina, até às bordas foram devoradas e carta de vinhos tem um excelente preço.","preço,comida"
"Excelente atendimento, ambiente, comida, bebida e preço justo por tudo isso.","preço,comida,bebida,ambiente,serviço"
Comida boa com preço justo.,"preço,comida"
Preço compatíveis com o serviço oferecido.,"preço,serviço"
Comparando com outros rodízios que são o mesmo valor deixa um pouco a desejar.,comida
Preço razoável mas compensa pela qualidade.,"preço,comida"
"Ambiente muito agradável, comida deliciosa e ótimo ótimo benefício!","preço,comida,ambiente"
O rodizio tem otimo custo beneficio e a qualidade do sushi permance alta.,"preço,comida"
"Comida deliciosa, variedades de pratos quentes e salada, bom preço, atendimento maravilhoso, banheiro limpinho, ar condicionado 2 ambientes.","preço,comida,ambiente,serviço"
Excelentes combos e com preço justo.,preço
"Bom atendimento, pratos diferenciados e bom custo benefício.","preço,comida,serviço"
Cardápio variado e de bom gosto preço  justo mas o espaço  é  apertado e  os pegadores de alimentos ficam em cima dos mesmos.,"preço,comida,ambiente"
"Prato muito saborosos, boas porções e preço justo!!!","preço,comida"
"Lugar agradável, comida deliciosa, atendimento de primeira (recomendo procurar o Marcelo ou Gabriel), preço razoável.","preço,comida,serviço,geral"
"Ambiente sempre aconchegante, comida regional de excelente qualidade, pirarucu, tambaqui, matrinxa sempre bem feitos, com preço bem acessível para o padrão do restaurante.","preço,comida,ambiente"
"Variedade, bom preço, ambiente climatizado!","preço,comida,ambiente"
"Para quem gosta de comida oriental é uma boa opção ,o custo benefício é razoável,mas o ambiente ,a boa comida e o atendimento compensam .","preço,comida,ambiente,serviço"
"Preço justo, comida ótima.","preço,comida"
"Melhor peixaria de Manaus, e tem um ótimo custo benefício!","preço,geral"
Tem o preço um pouco mais caro do...Mais,preço
"Excelente comida, e preço acessível","preço,comida"
"Excelente custo x benefício, hamburguer artesanal e atendimento massa!","preço,comida,serviço"
"Meu café preferido, atendimento ótimo, preço razoável, tudo de qualidade","preço,bebida,serviço"
Custo x benefício  compatível com o restaurante.,preço
Comida simples mas de boa qualidade e preço justo,"preço,comida"
Dessa forma tenho um preço igual para um produto menor.,preço
Comida típica deliciosa e com preço justo.,"preço,comida"
"Pizza boa, preço bom, playground para as crianças.","preço,comida,ambiente"
"Fomos super bem atendidas pelo Rafael, a comida como sempre maravilhosa e o custo benefício está entre os melhores de Manaus... Recomendadíssimo","preço,comida,serviço"
"Preço super acessível,  atendimento ótimo e super rápido.","preço,serviço"
"Bom, Vale o custo benefício",preço
Ótimo custo benefício!,preço
"Lugar extremamente agradável, otimo para passar um dia com a família ou amigos, comida boa (preço razoável), musica boa, pode-se alugar caiaques e pranchas de SUP, alem de tomar banho nas águas do rio negro, para quem nao sabe nadar é possível alugar macarrao ou...Mais","preço,comida,ambiente,geral"
Preço alto!,preço
"Ambiente agradável,  boa comida e preço justo para o que oferece.","preço,comida,ambiente"
"Local super confortável, combinaria perfeita, com várias opções e preço maravilhoso.","preço,comida,ambiente"
Preço justo para quem tem tempo disponível para desfrutar.,preço
"Boa qualidade, preço compatível,  atendimentonpode melhorar","preço,comida,serviço"
"Não é necessariamente o melhor custo benefício, mas vale.",preço
"Bom atendimento, lugar agradável.. estacionamento e preço justo.","preço,serviço,geral,localização"
"Atendimento ótimo, e preço razoável!","preço,serviço"
Público jovem de alto astral.,ambiente
"Preço justo, comida saborosa, fica pronta em pouco tempo.","preço,comida,serviço"
"Comida fria, o preço ate que não é ruim!","preço,comida"
"Atendimento excelente, comida deliciosa, e preço acessível.","preço,comida,serviço"
Pedi uma picanha nobre (angus) e esperava muito mais pelo valor cobrado.,"preço,comida"
Ótimo Atendimento... Preço bom....  Comida Perfeita.... Uma boa Opção para uma Janta.... Boa Localização,"preço,comida,serviço,localização"
Excelente custo benefício.,preço
Comida boa e preço justo,"preço,comida"
"Muito bom, preço bom, comida boa.","preço,comida"
"Além de ser bem atendido da recepção ao caixa, você ainda tem muita variedade de comidas por um preço muito acessível!","preço,comida,serviço"
"Hambúrgueres com o preço médio de R$15, servem bem uma pessoa.",comida
Lugar sensacional,geral
"Muito bom o local, mas poderia ser mais em conta.","geral,preço"
Ótimo lugar pra reunir os amigos,geral
Ótimo lugar pra tomar um chopp!,bebida
Ótimo lugar pra almoçar carne de sol em boa companhia.,comida
"Outra coisa ótima, desde ao estacionamento um local agradável.","localização,geral"
Um ótimo lugar para estar com os amigos cerveja sempre gelada.,"geral,bebida"
"Lugar agradável para um jantar em casal ou para quem quer levar a família completa, ótimo também para uma comemoração.",geral
"A Apresentação é o ponto alto dos pratos, o sabor falta um pouco mais de tempero, mas nada que deixe o prato ruim apenas poderia melhorar o sabor.",comida
Lugar aconchegante,ambiente
"Ambiente famíliar, excelente local para confraternização, cardápio muito bom e excelente atendimento.","ambiente,geral,comida,serviço"
Comida boa e local aconchegante,"comida,ambiente"
Muito bom e ótimo local pra conversar.,geral
Muito bom o local boa comida,"geral,comida"
excelente lugar!!,geral
Lugar bom porem pouca opção e valor muito superior para o lugar,"geral,comida,preço"
"Se você quer um bom rodízio de carne em Manaus, a Bufalo é o lugar ideal!!",comida
Lugar agradavel bom atendimento,"geral,serviço"
Local ruim pra estacionar,localização
Acho um lugar fantástico aconselho aos turistas conhecerem,geral
"lugar muito agradável muito confortável, mais a demora para fazer e a pizza e muito grande, no caso vc tem q ir jantado, pois o tempo de espera e tão grande que ate a pizza chegar em sua mesa vc ja fica com fome de novo, e sem falar da área externa aos fundos, pois e muito quente ao ponto de ser insuportável .","geral,ambiente,serviço"
Lugar aconchegante.,ambiente
Comida e ambiente excelentes tem estacionamento ótimo lugar pra levar a família.,"localização,comida,ambiente"
"Lugar aconchegante, bem servido, muito agradável.","ambiente,serviço"
"Lugar aprazível,  aconchegante,  ótimo atendimento.","ambiente,serviço"
Melhor lugar para se está com os amigos!,geral
"Otimo peixe, lugar bem agradavel e bom atendimento","comida,geral,serviço"
Demora no atendimento e um lugar quente,"serviço,ambiente"
O melhor lugar pra tomar um café regional!,bebida
"Lugar super agradável, comida excelente, preço acima da média , mas vale cada centavo investido em seu jantar.","geral,comida,preço"
"Excelente lugar, confortável com bom atendimento e variedade de comidas saborosas.","geral,ambiente,serviço,comida"
Lugar perfeito para levar a família e amigos!,geral
"Um bom local para realizar confraternizações, ambiente climatizado, e de boa comida.","ambiente,comida"
Lugar simples e cerveja gelada.,"geral,bebida"
Atendimento incrível da Natasha e o lugar maravilhoso.,"serviço,geral"
Único ponto negativo é o estacionamento.,localização
Lugar perfeito!!,geral
Ótimo lugar.,geral
Excelente lugar,geral
"Local muito bom e agradeço, peixe tambaqui recomendo.","geral,comida"
"Melhor lugar de MANAUS, para saborear aquela carne maravilhosa.","geral,comida"
"Excelente ambiente, mas atendimento precisa melhorar, ponto positivo para banheiros bem limpos e cheirosos e negativo pras recepcionistas que liberam as reservas (filas de mais de 30min)","geral,serviço,ambiente"
"É um lugar familiar,muito bom,porém as coisas são muito caras ...","geral,preço"
"Lugar muito lindinho e aconchegante , além de a comida ser muito boa, o local tem uma decoração linda!","ambiente,comida"
"Ótimo lugar, atendimento maravilhoso !","geral,serviço"
Excelente lugar!,geral
"Lugar maravilhoso, com ótimo atendimento.","geral,serviço"
"Comida boa, preços bons, local bom, não há estacionamento, garçons perdidos..","localização,comida,preço,serviço"
Lugar agradável,geral
Local muito agradável  com música boa,"geral,ambiente"
"Local agradável, tudo bem limpo e organizado,  atendimento excepcional meus parabéns ao atendente cabelo que é ágil e sai correndo para entregar os pedidos.","geral,ambiente,serviço"
"Um excelente lugar, funcionários educados e muito competentes,comida ótima.Um belo lugar para uma refeição com a família e amigos","geral,serviço,comida,bebida"
Lugar agradável,geral
"Uma boa variedade no cardápio, bebidas principalmente... Lugar super agradável para tomar uma boa cerveja com os amigos.","comida,bebida,geral"
Um bom lugar,geral
"Rodízio bem em conta R$ 29,90 lugar amplo para ir com os amigos, tem área pra criança (kids), variedade de pizza bem legal, mas se você gosta das doces vai esperar um pouquinho mais!","preço,ambiente,comida"
Lugar tranquilo e onde se pode comer bem pelo um preço justo.,"geral,comida,preço"
Segurança alimentar e local muito agradável.,"comida,geral"
Gostei muito do atendimento e do local e excelente localização e infraestrutura só achei que o sanduíche era melhor pois nas fotos divulgadas são maiores...,"serviço,localização,ambiente,comida"
"Evidente que não seria esse motivo mas seguramente foi uma experiência encantadora e recomendo vivamente .. em combinação ou independente de ir à praia de ponta negra que está muito bonita , nada melhor que coroar com a experiência gustativa do maravilhoso camarão e serviço...Mais","geral,ambiente,comida,serviço"
Lugar aconchegante e bom atendimento.,"ambiente,serviço"
"Lugar aconchegante, comida maravilhosa, preço justo.","ambiente,comida,preço"
Ótimo lugar pra se reunir com os amigos e comer aquela pizza gostosa ?,"geral,comida"
Lugar agradável.,geral
"Ótimo serviço, lugar muito bom para beber e conversar, mas o principal que é a comida, não é legal.","serviço,bebida,comida"
"Local bonito e comidas muito boas, porém o atendimento deixa a desejar.","ambiente,comida,serviço"
"Ótimo restaurante, lugar agradável para almoço em família, essa atendimento, ótima comida mas o estacionamento precisa melhorar.","localização,geral,comida"
Ótimo lugar aconchegante,"geral,ambiente"
Um local maravilhoso,geral
"Lugar OK, as pizzas não são tão boas.","geral,comida"
"Comida boa, lugar agradável ?","geral,comida"
Lugar aconchegante.,ambiente
"Lugar maravilhoso, comida ótima, não é climatizado, mas vale muito a pena, não esqueço do Ceviche único !","geral,comida,ambiente"
"Adolpho...melhor diversidades de cortes de carne da região, no ponto perfeito um verdadeiro gourmet de carnes!",comida
Uns dos melhores lugares pra se comer em Manaus.,geral
"Excelente lugar, muito gostoso.","geral,comida"
"Lugar bom, porém muito apertado o preço é um pouco elevado mas se paga pelo lugar.","geral,ambiente,preço"
Bom lugar para happy hour.,geral
excelente lugar para saborear as delícias que só no coco bambu tem.,comida
"Lugar muito bom, um espaço significativo.","geral,ambiente"
"Local agradável, amplo, vários ambientes e um ótimo atendimento.","geral,ambiente,serviço"
Lugar bem requintado e comida de alto padrão.,"geral,comida"
"Uma das melhores pizzarias da cidade, sem mimimi, parquinho para crianças, bom atendimento e a pizza é uma delícia","geral,ambiente,serviço,comida"
Ótimo lugar para quem busca a experiência e delícias da culinária italiana.,comida
"Lugar maravilhoso, comida incrível.","geral,comida"
"Lugar maravilhoso,comida muito boa","geral,comida"
"Lugar fino , elegante .",geral
"Lugar aconchegante, pizza saborosa.","geral,comida"
Lugar otimo e agradável.,geral
"Pratos típicos, bem apresentados e local aconchegante.","comida,ambiente"
"Lugar aconchegante, contíguo a loja de plantas do bairro parque das laranjeiras, o que confere ao local um ar de campo.",ambiente
"Vim para um aniversário e estava tudo maravilhoso, carne deliciosa e no ponto certo, além do atendimento excelente do Rolann","geral,comida,serviço"
Lugar muito agradável.,geral
"otimo lugar para ir com familia e amigos, rodizio de pizza bom, com muita variedade, atendimento a contento.","geral,comida,serviço"
"Excelente lugar, muito bonito e lanche muito bom.","geral,ambiente,comida"
Muito bom ja foi melhor,geral
"Dependendo do dia da semana e da hora, pode ser um local um pouco barulhento e agitado demais.",ambiente
12:00 só dá o povo do Distrito industrial.,outros
"Ótimo lugar, ambiente agradável, ótimo atendimento e comida deliciosa!","geral,comida,ambiente,serviço"
"para quem curti aquela picanha no ponto, e um otimo lugar  alem de ser um ambiente familiar e climatizado , um otimo atendimento e um custo bem acessivo   que dar para levar toda a familia...","geral,comida,ambiente,serviço,preço"
Gostei muito desse lugar ótimo lugar ????????,geral
Lugar agradável e ótimo atendimento o garçom Márcio foi muito atencioso.,"geral,serviço"
Incrível amo esse lugar ?,geral
"Lugar muito agradável, muito bom para ir com família e amigos ?",geral
Lugar bom e barato,"geral,preço"
Lugar moderno.,geral
"Atendimento muito, local aconchegante.",ambiente
"Excelente atendimento,lugar aconchegante","ambiente,serviço"
Local tradicional de Manaus.,geral
Ótimo lugar,geral
